{
    "id":"f5070c3a-cd39-4dc3-8dd2-4ad3b511c407",
    "actor":{"mbox":"mailto:tom@example.com", "name":"andy", "objectType":"Agent"},
    "verb":{"id":"http://tom.com/verb", "display":{"en":"hi"}},
    "object": {"id":"http://tom.com/obj"},
    "version":"1.0.2",
    "timestamp":"2017-03-23T21:14:21.690Z",
    "stored":"2017-03-23T21:14:45.282Z"
}
