{
    "actor":{"mbox":"mailto:tom@example.com"},
    "verb":{"id":"http://tom.com/verb", "display": {"en-GB-oed":"runneth"}},
    "object": {"id":"http://tom.com/obj"},
    "timestamp": "2017-02-31T20:53:06.892Z",
    "stored": "2017-02-31t20:53:06.010z",
    "id": "12345678-1234-1234-9234-1234567890ab"
}
